{
  "issues": [],
  "unavailable_reason": "no_linear_api_key",
  "fetched_at": null,
  "linear_endpoint": "https://api.linear.app/graphql",
  "note": "LINEAR_API_KEY environment variable was not set. Pipeline runs in degraded mode; Metric 6 falls back to conventional-commit-prefix classification; Metric 12 reports 'Insufficient signal — no SLA source' unless a repo policy document is found by a separate fallback pass.",
  "label_filter": [
    "bug",
    "defect"
  ]
}
